{
  "schemaVersion": 1,
  "slug": "google-gmail",
  "app": {
    "name": "Google (Gmail, Drive, Calendar)",
    "website": "https://developers.google.com",
    "docsUrl": "https://developers.google.com/identity/protocols/oauth2",
    "developerPortalUrl": "https://console.cloud.google.com/apis/credentials",
    "category": "Email, Files, Calendar",
    "oneLiner": "One OAuth client in Google Cloud covers Gmail, Drive, Calendar and the rest. The scopes you choose decide whether you wait a day or a quarter."
  },
  "generatedBy": "curated",
  "generatedAt": "2026-10-28T00:00:00Z",
  "lastVerifiedAt": "2026-10-28T00:00:00Z",
  "oauth": {
    "supportsOAuth": true,
    "flows": ["authorization_code", "pkce", "device_code"],
    "alternatives": ["service_account_domain_wide_delegation"],
    "composioManaged": "unknown",
    "composioToolkitSlug": "gmail",
    "dynamicClientRegistration": "no",
    "notes": "Scopes are tiered: non-sensitive, sensitive, restricted. Most Gmail and many Drive scopes are restricted."
  },
  "summary": {
    "difficulty": 5,
    "difficultyReason": "Restricted scopes (most of Gmail, broad Drive) require Google's app verification plus an annual third-party CASA security assessment. Sensitive-only scopes need verification without the assessment. Either way there is a real wait and a demo video.",
    "timeToDevReady": { "min": 30, "max": 60, "unit": "minutes", "confidence": "high", "note": "Testing mode works immediately for listed test users." },
    "timeToProduction": { "min": 2, "max": 8, "unit": "weeks", "confidence": "medium", "note": "Sensitive scopes only: reported under a week. Restricted scopes: Google says potentially several weeks; developers report 2-3 weeks when the CASA assessment runs in parallel, longer if findings must be fixed. Deeper cases are described as months." },
    "cost": "Verification is free. CASA Tier 2 assessment is paid to an approved assessor: reported roughly $500-$4,500 depending on assessor and scale, renewed annually.",
    "blockers": [
      { "text": "Restricted scopes require a security assessment under the CASA framework by a Google-approved third party, repeated at least every 12 months.", "severity": "hard", "evidence": { "level": "documented", "sourceIds": ["s1", "s2", "s3"] } },
      { "text": "Any sensitive or restricted scope requires app verification before unlimited users can authorize; in testing you are capped at 100 users.", "severity": "hard", "evidence": { "level": "documented", "sourceIds": ["s1", "s4"], "note": "100-user cap stated by Nango's guide; confirm against Google's consent-screen docs" } },
      { "text": "Branding changes (name, logo, homepage, authorized domains) force a resubmission.", "severity": "soft", "evidence": { "level": "reported", "sourceIds": ["s6"] } }
    ],
    "tldr": "You can have a working Gmail or Drive integration in an hour in testing mode, but only for up to 100 listed testers and with an 'unverified app' screen. Production means Google app verification, and for restricted scopes an annual paid CASA security assessment. Plan weeks, not days, and start the verification while you build."
  },
  "prerequisites": [
    { "text": "A Google Cloud project (free) with the Gmail/Drive/Calendar API enabled.", "owner": "you", "evidence": { "level": "documented", "sourceIds": ["s5"] } },
    { "text": "A verified domain you control (Search Console) for the homepage and privacy policy; the privacy policy must be hosted on that domain.", "owner": "you", "evidence": { "level": "reported", "sourceIds": ["s4", "s6"] } },
    { "text": "Decide your scope tier early. Classify every scope as non-sensitive, sensitive or restricted using Google's list; this single decision sets the production clock.", "owner": "agent", "evidence": { "level": "documented", "sourceIds": ["s1"] } },
    { "text": "If using restricted scopes and storing data on your servers: pick a Google-approved CASA assessor and run a first scan before you submit.", "owner": "agent", "evidence": { "level": "documented", "sourceIds": ["s1", "s4"] } }
  ],
  "paths": {
    "dev": [
      {
        "title": "Create the project and enable APIs",
        "detail": "In Google Cloud Console create a project, then enable Gmail API, Drive API or Calendar API under APIs & Services.",
        "owner": "you",
        "effort": "5 min",
        "consoleLocation": "APIs & Services > Library",
        "evidence": { "level": "documented", "sourceIds": ["s5"] }
      },
      {
        "title": "Configure the OAuth consent screen (branding + audience)",
        "detail": "Choose External user type. Enter app name, support email, logo, homepage, privacy policy and terms URLs, and authorized domains. Leave publishing status as Testing and add your test users.",
        "owner": "either",
        "effort": "15 min",
        "consoleLocation": "APIs & Services > OAuth consent screen (Google Auth Platform > Branding / Audience)",
        "values": [
          { "field": "User type", "value": "External" },
          { "field": "Authorized domain", "value": "YOUR_DOMAIN" },
          { "field": "Privacy policy URL", "value": "https://YOUR_DOMAIN/privacy (must be on the authorized domain)" },
          { "field": "Test users", "value": "your own accounts, up to 100" }
        ],
        "evidence": { "level": "documented", "sourceIds": ["s5", "s4"] }
      },
      {
        "title": "Add scopes, choosing the narrowest that works",
        "detail": "Prefer gmail.send over gmail.modify, drive.file over drive, calendar.events over calendar. drive.file is non-sensitive and avoids verification for file-picker style apps.",
        "owner": "agent",
        "effort": "10 min",
        "consoleLocation": "OAuth consent screen > Data access > Add or remove scopes",
        "values": [
          { "field": "Narrow Drive", "value": "https://www.googleapis.com/auth/drive.file" },
          { "field": "Gmail send only", "value": "https://www.googleapis.com/auth/gmail.send (restricted)" },
          { "field": "Gmail read", "value": "https://www.googleapis.com/auth/gmail.readonly (restricted)" }
        ],
        "evidence": { "level": "documented", "sourceIds": ["s1", "s7"] }
      },
      {
        "title": "Create an OAuth client ID",
        "detail": "Web application type; add your redirect URI. Download the client ID and secret.",
        "owner": "you",
        "effort": "5 min",
        "consoleLocation": "APIs & Services > Credentials > Create credentials > OAuth client ID",
        "values": [{ "field": "Authorized redirect URI", "value": "https://YOUR_DOMAIN/oauth/callback/google" }],
        "evidence": { "level": "documented", "sourceIds": ["s5"] }
      },
      {
        "title": "Authorize as a test user",
        "detail": "Run the flow with access_type=offline and prompt=consent to get a refresh token. In Testing publishing status, refresh tokens expire after 7 days, so re-consent during development.",
        "owner": "agent",
        "effort": "15 min",
        "evidence": { "level": "documented", "sourceIds": ["s5"], "note": "7-day expiry in Testing is stated in Google's OAuth2 overview under token expiration" }
      }
    ],
    "production": [
      {
        "title": "Build the feature end to end before submitting",
        "detail": "Google tests the integration during verification, so the OAuth flow and the feature that uses each scope must actually work in your app.",
        "owner": "agent",
        "effort": "part of your build",
        "evidence": { "level": "reported", "sourceIds": ["s4"] }
      },
      {
        "title": "Record the demo video and write scope justifications",
        "detail": "The verification form asks for a YouTube video showing the consent screen (with your client ID visible) and each scope in use, plus a written justification per scope. An agent can script the video and draft the justifications; a human records and uploads.",
        "owner": "either",
        "effort": "2-4 hours",
        "values": [{ "field": "Per-scope justification pattern", "value": "What the feature does, why this scope and not a narrower one, how data is used and not used" }],
        "evidence": { "level": "reported", "sourceIds": ["s4", "s6"] }
      },
      {
        "title": "Submit for verification (publishing status: In production)",
        "detail": "Switch publishing status and submit. Brand verification, sensitive-scope verification and restricted-scope verification are reviewed; expect questions back by email.",
        "owner": "you",
        "effort": "30 min + wait",
        "consoleLocation": "OAuth consent screen > Publishing status > Publish app > Prepare for verification",
        "evidence": { "level": "documented", "sourceIds": ["s1", "s5"] }
      },
      {
        "title": "Restricted scopes only: complete the CASA security assessment",
        "detail": "Google's verification team tells you a security assessment is required. Engage a Google-approved assessor, remediate findings (critical and high must be fixed), receive the Letter of Assessment/Validation, and submit it. Runs in parallel with the Trust & Safety review. Renew every 12 months from the letter's date.",
        "owner": "you",
        "effort": "2-3 weeks reported; longer with findings",
        "evidence": { "level": "documented", "sourceIds": ["s1", "s2", "s3"] }
      },
      {
        "title": "Wait, answer reviewer email, and keep branding frozen",
        "detail": "Reviews come back with questions; respond quickly. Changing app name, logo or domains during review restarts the branding check.",
        "owner": "you",
        "effort": "1-6 weeks waiting",
        "evidence": { "level": "reported", "sourceIds": ["s4", "s6"] }
      }
    ]
  },
  "requirements": [
    { "item": "Homepage on a verified domain you own", "required": true, "evidence": { "level": "reported", "sourceIds": ["s4", "s6"] } },